"id","name","description"
id_1,"Trato profesional en la atención","la persona que te atendió no lo hizo de forma adecuada."
id_2,"Tiempo","hubo demora antes y/o durante la atención que recibiste."
id_3,"Procedimiento","no se siguió el procedimiento de atención o no estás de acuerdo con este."
id_4,"Infraestructura","el ambiente en el que se realizó la atención y/o mobiliario no están en buen estado, no hay rutas accesibles que faciliten el desplazamiento de las personas o el local queda en un sitio inseguro."
id_5,"Información","la orientación sobre el servicio fue inadecuada, insuficiente o imprecisa."
id_6,"Resultado","no se pudo obtener un resultado concreto como parte del servicio y/o no se justifica la negativa en la atención del servicio."
id_7,"Confianza","ocurrió una situación que afectó la confianza y credibilidad de la entidad."
id_8,"Disponibilidad","el medio de atención (virtual, presencial o telefónico) por el que se brinda el servicio no responde a tus expectativas o tiene horarios restringidos."
id_9,"Otro",""